{
  "meta": {
    "schema_version": "1.0.0",
    "source": "new-plans.md + plans-deep-research-gemini.md",
    "description": "Canonical source for AI-generated Kubernetes learning paths.",
    "language": "en",
    "generated_on": "2026-02-18"
  },
  "commands": [
    {
      "id": "kubectl.get.nodes",
      "template": "kubectl get nodes -o wide"
    },
    {
      "id": "kubectl.get.pods.ns",
      "template": "kubectl get pods -n <namespace>"
    },
    {
      "id": "kubectl.get.pods.all",
      "template": "kubectl get pods -A"
    },
    {
      "id": "kubectl.describe.pod",
      "template": "kubectl describe pod <pod> -n <namespace>"
    },
    {
      "id": "kubectl.logs.pod",
      "template": "kubectl logs <pod> -n <namespace>"
    },
    {
      "id": "kubectl.exec.pod",
      "template": "kubectl exec -it <pod> -n <namespace> -- <cmd>"
    },
    {
      "id": "kubectl.apply.file",
      "template": "kubectl apply -f <file.yaml> -n <namespace>"
    },
    {
      "id": "kubectl.delete.file",
      "template": "kubectl delete -f <file.yaml> -n <namespace>"
    },
    {
      "id": "kubectl.scale.deployment",
      "template": "kubectl scale deploy/<name> --replicas=<n> -n <namespace>"
    },
    {
      "id": "kubectl.rollout.status",
      "template": "kubectl rollout status deploy/<name> -n <namespace>"
    },
    {
      "id": "kubectl.rollout.undo",
      "template": "kubectl rollout undo deploy/<name> -n <namespace>"
    },
    {
      "id": "kubectl.create.configmap",
      "template": "kubectl create configmap <name> --from-literal=<k>=<v> -n <namespace>"
    },
    {
      "id": "kubectl.create.secret.generic",
      "template": "kubectl create secret generic <name> --from-literal=<k>=<v> -n <namespace>"
    },
    {
      "id": "kubectl.auth.can-i",
      "template": "kubectl auth can-i <verb> <resource> -n <namespace>"
    },
    {
      "id": "kubectl.top.pods",
      "template": "kubectl top pods -n <namespace>"
    },
    {
      "id": "kubectl.get.events",
      "template": "kubectl get events -n <namespace> --sort-by=.metadata.creationTimestamp"
    },
    {
      "id": "kubectl.explain",
      "template": "kubectl explain <resource[.field]>"
    },
    {
      "id": "kubectl.get.yaml",
      "template": "kubectl get <resource> <name> -n <namespace> -o yaml"
    },
    {
      "id": "kubectl.patch",
      "template": "kubectl patch <resource> <name> -n <namespace> --type merge -p <json>"
    },
    {
      "id": "kubectl.debug",
      "template": "kubectl debug <pod> -n <namespace> -it --image=busybox --target=<container>"
    },
    {
      "id": "kubectl.get.gateway",
      "template": "kubectl get gateway,httproute -n <namespace>"
    },
    {
      "id": "helm.install",
      "template": "helm install <release> <chart> -n <namespace> --create-namespace"
    },
    {
      "id": "helm.upgrade",
      "template": "helm upgrade <release> <chart> -n <namespace>"
    },
    {
      "id": "kubeadm.upgrade.plan",
      "template": "kubeadm upgrade plan"
    },
    {
      "id": "etcdctl.snapshot.save",
      "template": "ETCDCTL_API=3 etcdctl snapshot save <file.db> ..."
    },
    {
      "id": "etcdctl.snapshot.restore",
      "template": "ETCDCTL_API=3 etcdctl snapshot restore <file.db> ..."
    }
  ],
  "assessments": [
    {
      "id": "quiz.generic.mcq-single",
      "type": "mcq_single",
      "description": "Valider la compréhension d'un concept clé du topic.",
      "question": "Quelle option décrit le mieux le concept présenté ?",
      "options": [
        "A",
        "B",
        "C",
        "D"
      ],
      "answer_index": 0
    },
    {
      "id": "quiz.generic.mcq-multi",
      "type": "mcq_multi",
      "description": "Identifier plusieurs assertions correctes dans un contexte Kubernetes.",
      "question": "Quelles affirmations sont correctes ?",
      "options": [
        "A",
        "B",
        "C",
        "D"
      ],
      "answer_indices": [
        0,
        2
      ]
    },
    {
      "id": "quiz.generic.order-sequence",
      "type": "order_sequence",
      "description": "Remettre dans le bon ordre un workflow opérationnel Kubernetes.",
      "items": [
        "Observer",
        "Appliquer",
        "Verifier",
        "Depanner"
      ],
      "solution_order": [
        0,
        1,
        2,
        3
      ],
      "explanation": "On observe avant de modifier, puis on vérifie et on dépanne."
    }
  ],
  "modules": [
    {
      "id": "onboarding",
      "description": "Prise en main de la plateforme et contexte des certifications.",
      "status": "ready",
      "prerequisites": [],
      "tags": [
        "ckad",
        "cka",
        "beginner"
      ],
      "topics": [
        {
          "id": "how-to-use-this-platform",
          "order": 1,
          "description": "Navigation, interface, terminal intégré",
          "theory_only": false,
          "commands": [
            "kubectl.get.nodes"
          ],
          "assessment_ids": [
            "quiz.generic.mcq-single",
            "quiz.generic.order-sequence"
          ],
          "prerequisites": []
        },
        {
          "id": "your-practice-environment",
          "order": 2,
          "description": "kubectl, cluster, connexion",
          "theory_only": false,
          "commands": [
            "kubectl.get.nodes"
          ],
          "assessment_ids": [
            "quiz.generic.mcq-single",
            "quiz.generic.order-sequence"
          ],
          "prerequisites": []
        },
        {
          "id": "certification-overview",
          "order": 3,
          "description": "CKAD vs CKA, format, conseils",
          "theory_only": false,
          "commands": [
            "kubectl.get.nodes"
          ],
          "assessment_ids": [
            "quiz.generic.mcq-single",
            "quiz.generic.order-sequence"
          ],
          "prerequisites": []
        }
      ]
    },
    {
      "id": "kubernetes-basics",
      "description": "Qu'est-ce que Kubernetes, pourquoi l'utiliser, vue d'ensemble de l'architecture.",
      "status": "ready",
      "prerequisites": [],
      "tags": [
        "ckad",
        "cka",
        "beginner"
      ],
      "topics": [
        {
          "id": "what-is-kubernetes",
          "order": 1,
          "description": "Orchestration de conteneurs, ce que K8s fait et ne fait pas",
          "theory_only": false,
          "commands": [
            "kubectl.get.nodes",
            "kubectl.explain"
          ],
          "assessment_ids": [
            "quiz.generic.mcq-single",
            "quiz.generic.order-sequence"
          ],
          "prerequisites": []
        },
        {
          "id": "evolution-of-deployment",
          "order": 2,
          "description": "Physique → VMs → Containers → Orchestration",
          "theory_only": false,
          "commands": [
            "kubectl.get.nodes",
            "kubectl.explain"
          ],
          "assessment_ids": [
            "quiz.generic.mcq-single",
            "quiz.generic.order-sequence"
          ],
          "prerequisites": []
        },
        {
          "id": "cluster-architecture-overview",
          "order": 3,
          "description": "Control plane vs worker nodes, vue 10 000 pieds",
          "theory_only": false,
          "commands": [
            "kubectl.get.nodes",
            "kubectl.explain"
          ],
          "assessment_ids": [
            "quiz.generic.mcq-single",
            "quiz.generic.order-sequence"
          ],
          "prerequisites": []
        },
        {
          "id": "control-plane-components",
          "order": 4,
          "description": "apiserver, etcd, scheduler, controller-manager",
          "theory_only": false,
          "commands": [
            "kubectl.get.nodes",
            "kubectl.explain"
          ],
          "assessment_ids": [
            "quiz.generic.mcq-single",
            "quiz.generic.order-sequence"
          ],
          "prerequisites": []
        },
        {
          "id": "node-components",
          "order": 5,
          "description": "kubelet, kube-proxy, container runtime",
          "theory_only": false,
          "commands": [
            "kubectl.get.nodes",
            "kubectl.explain"
          ],
          "assessment_ids": [
            "quiz.generic.mcq-single",
            "quiz.generic.order-sequence"
          ],
          "prerequisites": []
        }
      ]
    },
    {
      "id": "yaml-and-objects",
      "description": "Comprendre la structure des objets Kubernetes et le format YAML.",
      "status": "ready",
      "prerequisites": [
        "kubernetes-basics"
      ],
      "tags": [
        "ckad",
        "cka",
        "beginner"
      ],
      "topics": [
        {
          "id": "kubernetes-object-model",
          "order": 1,
          "description": "Entités persistantes, spec vs status, desired state",
          "theory_only": false,
          "commands": [
            "kubectl.explain",
            "kubectl.get.yaml"
          ],
          "assessment_ids": [
            "quiz.generic.mcq-single",
            "quiz.generic.order-sequence"
          ],
          "prerequisites": []
        },
        {
          "id": "anatomy-of-a-manifest",
          "order": 2,
          "description": "apiVersion, kind, metadata, spec — décortiqué",
          "theory_only": false,
          "commands": [
            "kubectl.explain",
            "kubectl.get.yaml"
          ],
          "assessment_ids": [
            "quiz.generic.mcq-single",
            "quiz.generic.order-sequence"
          ],
          "prerequisites": []
        },
        {
          "id": "generating-manifests-from-cli",
          "order": 3,
          "description": "`kubectl run --dry-run=client -o yaml`",
          "theory_only": false,
          "commands": [
            "kubectl.explain",
            "kubectl.get.yaml"
          ],
          "assessment_ids": [